{
 "requestId": "REQ-000003",
 "contractVersion": "1.0",
 "batch": "B3",
 "mode": "generate",
 "layer": "L2",
 "status": "PREPARED",
 "dependsOn": [],
 "expectedOutputs": [
  {
   "tempId": "tmp:L2|CM-03",
   "type": "core-module",
   "key": "L2|CM-03",
   "brief": {
    "coreModule": "CM-03",
    "name": "Selling",
    "situationCategories": [
     "SC03"
    ],
    "usedByFamilies": [
     "SALE",
     "RTLF",
     "MKTV",
     "WHTR",
     "FNB",
     "TRVF",
     "AUTF",
     "AGRF",
     "FSHR",
     "BNKF",
     "INSF",
     "MKTG",
     "OPTF",
     "BEAF",
     "ENTR"
    ]
   }
  },
  {
   "tempId": "tmp:L2|CM-04",
   "type": "core-module",
   "key": "L2|CM-04",
   "brief": {
    "coreModule": "CM-04",
    "name": "Transactions & payment",
    "situationCategories": [
     "SC04"
    ],
    "usedByFamilies": [
     "SALE",
     "RTLF",
     "MKTV",
     "WHTR",
     "FO",
     "FNB",
     "DLVR",
     "DRVR",
     "TRDF",
     "AGRF",
     "FSHR",
     "PHRF",
     "BEAF"
    ]
   }
  },
  {
   "tempId": "tmp:L2|CM-06",
   "type": "core-module",
   "key": "L2|CM-06",
   "brief": {
    "coreModule": "CM-06",
    "name": "Delivery & mobility",
    "situationCategories": [
     "SC05"
    ],
    "usedByFamilies": [
     "DLVR",
     "DRVR"
    ]
   }
  },
  {
   "tempId": "tmp:L2|CM-11",
   "type": "core-module",
   "key": "L2|CM-11",
   "brief": {
    "coreModule": "CM-11",
    "name": "Management",
    "situationCategories": [
     "SC18",
     "SC19",
     "SC20",
     "SC21",
     "SC22",
     "SC23"
    ],
    "usedByFamilies": []
   }
  },
  {
   "tempId": "tmp:L2|CM-10",
   "type": "core-module",
   "key": "L2|CM-10",
   "brief": {
    "coreModule": "CM-10",
    "name": "Team supervision",
    "situationCategories": [
     "SC14",
     "SC19",
     "SC20"
    ],
    "usedByFamilies": []
   }
  }
 ],
 "context": {
  "pilot": {
   "id": "U-1",
   "purpose": "Architecture-validation prototype approved by the author on 4 October 2026. Not for publication. Final state may never be COMPILED or PUBLISHED."
  },
  "policies": {
   "D-U11": "Job knowledge only to make communication realistic; not certification. No invented safety instructions, public procedures or legal/medical/financial advice. Factual claims in regulated areas must be traceable; U-1 avoids them.",
   "D-U12": "Hybrid characters: role-specific realistic characters and reusable stakeholder archetypes; no single permanent character; Arif is not used.",
   "D-U14": "Learning cycle for new role content: Context → Notice → Understand → Guided Practice → Role Practice → Performance Task → Feedback → Review/Retrieval. Not claimed to exist in the current book.",
   "D-U07": "Vocabulary: propose terms only; the repository assigns V-<SCOPE>-<NUMBER> codes and reuses existing codes. Never invent codes.",
   "D-U10": "Generate only the requested delta. Do not regenerate objects supplied in context."
  },
  "style": {
   "spelling": "UK",
   "dateFormat": "UK (e.g. 4 October 2026)",
   "register": "professional, respectful, realistic",
   "currency": "Indian rupees (₹) unless the situation requires otherwise",
   "payments": "cash, UPI, card as realistic",
   "names": "realistic South Asian names by default; international names where the context has them; no stereotypes",
   "brands": "no real company or brand names; use generic descriptions (e.g. 'the delivery app', 'the dealership')",
   "languages": "English only. No Bengali or Hindi script or transliteration in U-1.",
   "audio": "None. Content must be fully usable as text (D-U06)."
  },
  "review": "Output is stored as GENERATED, then AI QA, then Editorial Review by the author. Specialist and native review are NOT_REQUIRED for U-1. It is never published.",
  "note": "Core modules are shared by every role family that uses them; keep them role- and industry-neutral."
 },
 "style": {
  "spelling": "UK",
  "dateFormat": "UK (e.g. 4 October 2026)",
  "register": "professional, respectful, realistic",
  "currency": "Indian rupees (₹) unless the situation requires otherwise",
  "payments": "cash, UPI, card as realistic",
  "names": "realistic South Asian names by default; international names where the context has them; no stereotypes",
  "brands": "no real company or brand names; use generic descriptions (e.g. 'the delivery app', 'the dealership')",
  "languages": "English only. No Bengali or Hindi script or transliteration in U-1.",
  "audio": "None. Content must be fully usable as text (D-U06)."
 },
 "limits": {
  "maxSummaryWords": 120,
  "moves": [
   4,
   10
  ]
 },
 "outputSchema": {
  "coreModule": "CM id",
  "summary": "≤120 words",
  "communicationMoves": "4–10 objects {move, functions[CFN]}",
  "qualityCriteria": "what good performance looks like (strings)"
 },
 "instructions": [
  "Return ONE JSON object only (no prose, no Markdown fences), conforming to the response format in 'responseFormat'.",
  "Produce exactly the outputs listed in 'expectedOutputs', using their tempId, type and key unchanged.",
  "Generate only these outputs. Do not regenerate objects given in 'context' — use them.",
  "Do not invent IDs or vocabulary codes. Reference existing codes only as given in context; propose new vocabulary with tempIds.",
  "English only: no Bengali/Hindi script or transliteration. No audio references. No real brand or company names.",
  "No legal, medical, financial or safety advice; no invented procedures or rules (D-U11).",
  "Report honestly in selfCheck: 'met', 'not met' or 'uncertain'. Never claim approval, certification or CEFR validation."
 ],
 "responseFormat": {
  "requestId": "<copy>",
  "contractVersion": "1.0",
  "model": "<model name if known>",
  "outputs": [
   {
    "tempId": "<copy>",
    "type": "<copy>",
    "key": "<copy>",
    "record": {
     "content": "<object per outputSpec>"
    }
   }
  ],
  "selfCheck": [
   {
    "check": "<name>",
    "result": "met | not met | uncertain",
    "notes": "<text>"
   }
  ],
  "assumptions": [],
  "flags": [],
  "questions": []
 },
 "estimate": {
  "inputTokens": 1346,
  "maxOutputTokens": 3000
 }
}
